{
  "schema_version": "1.0",
  "mock_execution_request_id": "mreq_pass_001",
  "gate_result_id": "gres_pass_001",
  "gate_request_id": "greq_pass_001",
  "dispatch_packet_id": "dispatch_pass_001",
  "freeze_manifest_id": "fmz_pass_001",
  "approval_ledger_entry_id": "led_pass_001",
  "operator_decision_id": "odp_pass_001",
  "platform_targets": ["x_twitter", "linkedin"],
  "frozen_payload_hash_refs": ["canonical_json_sha256:abc123"],
  "requested_mock_action": "create_mock_record",
  "precondition_summary": {
    "gate_result_pass": true,
    "freeze_manifest_complete": true,
    "approval_ledger_pass": true,
    "dispatch_packet_not_live": true,
    "payload_hashes_present": true,
    "audit_binding_required": true,
    "kill_switch_clear_for_mock": true,
    "no_blocked_states": true
  },
  "manual_publish_only": true,
  "mock_only": true,
  "network_allowed": false,
  "credential_access_allowed": false,
  "platform_api_allowed": false,
  "live_execution_allowed": false,
  "operator_review_required": true,
  "public_ready": false,
  "live_ready": false,
  "executable_dispatch": false,
  "validation_state": "PASS",
  "blocked_reasons": []
}
